{
  "$schema": "https://json-schema.org/draft/2020-12/schema",
  "$id": "https://github.com/ShaneMcGovernIE/my-mod-index/schema/mod.schema.json",
  "title": "gen1recomp mod index entry",
  "description": "One mods/<Author>@<id>/meta.json entry. Mirrors the fields the engine's manifest.json declares (see wiki: Reference-Manifest) plus the index-only fields the site and launcher need to find and update the mod.",
  "type": "object",
  "additionalProperties": false,
  "required": [
    "id",
    "title",
    "author",
    "version",
    "categories",
    "repo"
  ],
  "properties": {
    "id": {
      "type": "string",
      "pattern": "^[A-Za-z0-9_-]+$",
      "maxLength": 64,
      "description": "Must equal the mod's manifest.json id."
    },
    "title": {
      "type": "string",
      "minLength": 1,
      "maxLength": 80
    },
    "author": {
      "type": "string",
      "minLength": 1,
      "maxLength": 64
    },
    "summary": {
      "type": "string",
      "maxLength": 200,
      "description": "One-line blurb for the card. Long form goes in description.md."
    },
    "version": {
      "type": "string",
      "pattern": "^\\d+\\.\\d+\\.\\d+(?:[-+].*)?$",
      "description": "Semver of the release this entry describes."
    },
    "categories": {
      "type": "array",
      "minItems": 1,
      "maxItems": 4,
      "uniqueItems": true,
      "items": {
        "enum": [
          "GAMEPLAY",
          "CONTENT",
          "BALANCE",
          "ART",
          "AUDIO",
          "UI",
          "QOL",
          "TRANSLATION",
          "TOTAL_CONVERSION",
          "LIBRARY",
          "TOOL",
          "OTHER"
        ]
      }
    },
    "tags": {
      "type": "array",
      "maxItems": 8,
      "items": {
        "type": "string",
        "pattern": "^[a-z0-9][a-z0-9 -]{0,23}$"
      }
    },
    "repo": {
      "type": "string",
      "format": "uri",
      "pattern": "^https://",
      "description": "Where the source lives. Any host; GitHub unlocks version tracking."
    },
    "github": {
      "type": "string",
      "pattern": "^[A-Za-z0-9._-]+/[A-Za-z0-9._-]+$",
      "description": "owner/repo. Matches the manifest's github field: the launcher's Update / Versions path reads this repo's Releases."
    },
    "downloadURL": {
      "type": "string",
      "format": "uri",
      "pattern": "^https://",
      "description": "Direct link to an installable .zip (files at the archive root). Required when github is absent."
    },
    "automatic_version_check": {
      "type": "boolean",
      "default": true,
      "description": "When true and github is set, the index refresh job re-reads Releases nightly and records the newest version."
    },
    "fixed_release_tag": {
      "type": "string",
      "description": "Pin the index to one release tag instead of tracking the newest."
    },
    "api": {
      "type": "integer",
      "minimum": 1,
      "maximum": 2,
      "description": "Mod API the mod is written against (manifest api)."
    },
    "game_version": {
      "type": "string",
      "maxLength": 64,
      "description": "Engine semver range the mod needs, same grammar as the manifest."
    },
    "profile": {
      "enum": [
        "content",
        "overhaul",
        "total_conversion"
      ]
    },
    "affects_link": {
      "type": "boolean",
      "description": "Whether the mod is expected to move the link fingerprint. Defaults per profile, like the manifest."
    },
    "experimental": {
      "type": "boolean",
      "default": false
    },
    "permissions": {
      "type": "array",
      "uniqueItems": true,
      "items": {
        "enum": [
          "network",
          "filesystem",
          "engine_internals"
        ]
      }
    },
    "dependencies": {
      "type": "array",
      "items": {
        "type": "string",
        "pattern": "^[A-Za-z0-9_-]+(@.+)?$"
      }
    },
    "conflicts": {
      "type": "array",
      "items": {
        "type": "string",
        "pattern": "^[A-Za-z0-9_-]+(@.+)?$"
      }
    },
    "license": {
      "type": "string",
      "maxLength": 64
    },
    "folderName": {
      "type": "string",
      "pattern": "^[A-Za-z0-9_-]+$",
      "description": "Install folder name if it must differ from id."
    }
  }
}