{
  "id": "bag_999",
  "title": "999 Bag Slots",
  "author": "ShaneMcGovernIE",
  "summary": "Raises the bag's capacity to 999 slots and adds TAB / R3 (right stick) to sort the bag by name or count.",
  "version": "1.1.0",
  "categories": [
    "QOL"
  ],
  "tags": [
    "bag",
    "inventory",
    "items"
  ],
  "repo": "https://github.com/ShaneMcGovernIE/bag-999",
  "github": "ShaneMcGovernIE/bag-999",
  "automatic_version_check": true,
  "api": 2,
  "game_version": ">=0.0.0-0 <2.0.0",
  "profile": "content",
  "permissions": [
    "engine_internals"
  ]
}