{
  "id": "exp_share",
  "title": "Exp Share (Gen 1 / Gen 5+ styles)",
  "author": "ShaneMcGovernIE",
  "summary": "Party-wide EXP from the OPTIONS menu: Gen 1 Exp. All style or Gen 5+ style, with one shared-exp line instead of a message per Pokemon.",
  "version": "0.1.1",
  "categories": [
    "GAMEPLAY"
  ],
  "tags": [
    "exp",
    "share",
    "qol"
  ],
  "repo": "https://github.com/ShaneMcGovernIE/exp_share",
  "github": "ShaneMcGovernIE/exp_share",
  "automatic_version_check": true,
  "api": 2,
  "game_version": ">=0.0.0-dev <1.0.0",
  "profile": "content",
  "permissions": [
    "engine_internals"
  ]
}
