{
  "id": "useful_dex",
  "title": "Useful Dex",
  "author": "ShaneMcGovernIE",
  "summary": "In the Pok\u00e9dex, press A to cycle the species data page into base stats, BST and evolutions, then the full movelist (learned + TM/HM).",
  "version": "1.1.0",
  "categories": [
    "UI"
  ],
  "tags": [
    "pokedex",
    "stats",
    "info"
  ],
  "repo": "https://github.com/ShaneMcGovernIE/useful_dex",
  "github": "ShaneMcGovernIE/useful_dex",
  "automatic_version_check": true,
  "api": 2,
  "game_version": ">=0.0.0-0 <2.0.0",
  "profile": "content",
  "permissions": [
    "engine_internals"
  ]
}