{
  "id": "bag_999_fill",
  "title": "999 Bag Slots - Test Fill",
  "author": "ShaneMcGovernIE",
  "summary": "Test companion to bag_999: raises the bag to 999 slots and pre-fills it with one of every item on boot, so the capacity is visible in one glance.",
  "version": "1.0.1",
  "categories": [
    "OTHER"
  ],
  "tags": [
    "bag",
    "999",
    "test"
  ],
  "repo": "https://github.com/ShaneMcGovernIE/bag_999_fill",
  "github": "ShaneMcGovernIE/bag_999_fill",
  "automatic_version_check": true,
  "api": 2,
  "game_version": ">=0.1.37 <2.0.0",
  "profile": "content",
  "permissions": [
    "engine_internals"
  ]
}
