{
  "id": "qol_toggles",
  "title": "QoL Toggles",
  "author": "ShaneMcGovernIE",
  "summary": "OPTIONS -> USEFUL TOGGLES submenu with nine switches: poison survival, full-heal catches, infinite repel, learnable field moves, badgeless moves, always-catch, perfect DVs, double EXP and instant flee.",
  "version": "1.2.0",
  "categories": [
    "QOL"
  ],
  "tags": [
    "toggles",
    "options",
    "qol"
  ],
  "repo": "https://github.com/ShaneMcGovernIE/qol_toggles",
  "github": "ShaneMcGovernIE/qol_toggles",
  "automatic_version_check": true,
  "api": 2,
  "game_version": ">=0.0.0-dev <1.0.0",
  "profile": "content",
  "permissions": [
    "engine_internals"
  ]
}
