{
  "id": "game_speed_toggle",
  "title": "Game Speed Toggle",
  "author": "ShaneMcGovernIE",
  "summary": "Cycle game speed between 1X, 2X, 4X and 10X with the 9 key (keyboard) or SELECT + LEFT BUMPER (gamepad).",
  "version": "1.0.1",
  "categories": [
    "QOL"
  ],
  "tags": [
    "speed",
    "toggle",
    "fast-forward"
  ],
  "repo": "https://github.com/ShaneMcGovernIE/game_speed_toggle",
  "github": "ShaneMcGovernIE/game_speed_toggle",
  "automatic_version_check": true,
  "api": 2,
  "game_version": ">=0.0.0-0 <2.0.0",
  "profile": "content",
  "permissions": [
    "engine_internals"
  ]
}