{
  "id": "relearn_moves",
  "title": "Move Relearn",
  "author": "ShaneMcGovernIE",
  "summary": "Party menu gains RELEARN at the bottom of the field submenu (after SWITCH) to relearn any level-up move the mon has reached the level for; HM forget honors QoL Toggles.",
  "version": "1.4.0",
  "categories": [
    "GAMEPLAY",
    "QOL"
  ],
  "tags": [
    "party",
    "moves",
    "relearn"
  ],
  "repo": "https://github.com/ShaneMcGovernIE/relearn_moves",
  "github": "ShaneMcGovernIE/relearn_moves",
  "automatic_version_check": true,
  "api": 2,
  "game_version": ">=0.0.0-0 <2.0.0",
  "profile": "content",
  "permissions": [
    "engine_internals"
  ]
}
