{
  "id": "battle_move_info",
  "title": "Battle Move Info",
  "author": "ShaneMcGovernIE",
  "summary": "In battle, press L while a move is highlighted to see its type, power, accuracy and effect.",
  "version": "1.1.2",
  "categories": [
    "UI"
  ],
  "tags": [
    "battle",
    "moves",
    "info"
  ],
  "repo": "https://github.com/ShaneMcGovernIE/battle_move_info",
  "github": "ShaneMcGovernIE/battle_move_info",
  "automatic_version_check": true,
  "api": 2,
  "game_version": ">=0.0.0-0 <2.0.0",
  "profile": "content",
  "permissions": [
    "engine_internals"
  ]
}