{
  "id": "CONTROLLER_RUMBLE",
  "title": "Controller Rumble",
  "author": "ShaneMcGovernIE",
  "summary": "Controller rumble for Gen 1 shakes plus modern extras: battle hits/heals/EXP, catch wobbles, menus, fishing, field moves, items/dex, slots, trades/link, and more. Categories: Battle FX / Ambient /...",
  "version": "1.0.2",
  "categories": [
    "GAMEPLAY"
  ],
  "tags": [
    "controller",
    "rumble",
    "haptics"
  ],
  "repo": "https://github.com/masterwebx/gen1recomp-controller-rumble",
  "github": "masterwebx/gen1recomp-controller-rumble",
  "automatic_version_check": true,
  "api": 2,
  "game_version": ">=0.1.37 <2.0.0",
  "profile": "content",
  "permissions": [
    "engine_internals"
  ]
}