{
  "id": "CryReplacementMod",
  "title": "Pokémon Cry Replacement",
  "author": "ShaneMcGovernIE",
  "summary": "Replaces all 151 Pokémon cries with Fire Red/Leaf Green and anime cries, switchable on the fly from the options menu (Original / Fire Red / Anime).",
  "version": "1.0.0",
  "categories": [
    "AUDIO"
  ],
  "tags": [
    "cries",
    "audio",
    "anime"
  ],
  "repo": "https://github.com/ShaneMcGovernIE/CryReplacementMod",
  "downloadURL": "https://github.com/ShaneMcGovernIE/CryReplacementMod/archive/refs/heads/main.zip",
  "api": 2,
  "game_version": ">=0.1.37 <2.0.0",
  "profile": "content",
  "permissions": [
    "engine_internals"
  ]
}
