{
  "id": "violette",
  "title": "Pok\u00e9mon Version Violette",
  "author": "ShaneMcGovernIE",
  "summary": "Ports the data layer of the French romhack Pok\u00e9mon Version Violette GBC onto gen1recomp in English: 166-dex species rework, Gen-2 type chart with DARK/STEEL, 176 moves, reworked encounters and tra...",
  "version": "0.2.0",
  "categories": [
    "GAMEPLAY"
  ],
  "tags": [
    "romhack",
    "yellow",
    "french"
  ],
  "repo": "https://github.com/ShaneMcGovernIE/violette",
  "github": "ShaneMcGovernIE/violette",
  "automatic_version_check": true,
  "api": 2,
  "game_version": ">=0.0.0-0 <2.0.0",
  "profile": "content",
  "permissions": [
    "engine_internals"
  ]
}